### ISSUE TITLE
포스트맨이 length 0 짜리 요청을 보내서 에러발생

### ISSUE THREAD

**Issue by ksundong** [ksundong/java-http-server#3]
tcpdump

```
❯ tcpdump -i lo0 dst port 80
tcpdump: verbose output suppressed, use -v or -vv for full protocol decode
listening on lo0, link-type NULL (BSD loopback), capture size 262144 bytes
21:46:09.972616 IP6 localhost.63116 > localhost.http: Flags [S], seq 1789681084, win 65535, options [mss 16324,nop,wscale 6,nop,nop,TS val 497349467 ecr 0,sackOK,eol], length 0
21:46:09.972725 IP6 localhost.63116 > localhost.http: Flags [.], ack 1731266919, win 6371, options [nop,nop,TS val 497349467 ecr 497349467], length 0
21:46:09.972923 IP6 localhost.63117 > localhost.http: Flags [S], seq 1243050489, win 65535, options [mss 16324,nop,wscale 6,nop,nop,TS val 497349467 ecr 0,sackOK,eol], length 0
21:46:09.972966 IP6 localhost.63116 > localhost.http: Flags [F.], seq 0, ack 1, win 6371, options [nop,nop,TS val 497349467 ecr 497349467], length 0
21:46:09.973012 IP6 localhost.63117 > localhost.http: Flags [.], ack 3286372273, win 6371, options [nop,nop,TS val 497349467 ecr 497349467], length 0
21:46:09.973269 IP6 localhost.63117 > localhost.http: Flags [P.], seq 0:221, ack 1, win 6371, options [nop,nop,TS val 497349467 ecr 497349467], length 221: HTTP: GET / HTTP/1.1
21:46:09.979817 IP6 localhost.63116 > localhost.http: Flags [.], ack 2, win 6371, options [nop,nop,TS val 497349474 ecr 497349474], length 0
```

보면 63116번과 63117번 포트에서 전송이 되는데
63116번 포트는 length0짜리를 전송한다.
